{
  "schema": "agent-workflow/evaluation-plan/v1",
  "objective": "Recover and independently verify the missing BKL-001 completion evidence without rewriting the interrupted historical run.",
  "hypothesis": "The existing BKL-001 worktree satisfies its declared acceptance criteria and can produce a complete structured handoff when run through the current lifecycle protocol.",
  "identity": {
    "ticket_id": "BKL-001",
    "pack_id": "orchestrator-two-way-messaging",
    "source_revision": "e1141f12df700c1b51878242d83232f96361972a"
  },
  "execution": {
    "provider": "codex",
    "model": "gpt-5.6-luna",
    "executor": "codex",
    "executor_version": null
  },
  "cohort": {
    "cohort_id": "bkl-001-evidence-recovery",
    "role": "candidate",
    "controls": [
      "same dedicated BKL-001 worktree",
      "same ticket and pack identity",
      "structured non-interactive provider stream",
      "no source or backlog changes during evidence recovery"
    ]
  },
  "dataset_split": "development",
  "task_ids": [
    "BKL-001"
  ],
  "repetitions": 1,
  "timeout_seconds": 900,
  "max_retries": 0,
  "scorers": [
    "schema_validity",
    "writable_scope"
  ],
  "acceptance_commands": [
    {
      "id": "bkl-001-focused-tests",
      "argv": [
        "python3",
        "-m",
        "pytest",
        "-q",
        "tests/invariants/test_consumer_cursors.py",
        "tests/acceptance/test_consumer_cursor_journey.py"
      ],
      "cwd": ".",
      "timeout_seconds": 300,
      "result_format": "exit-code",
      "junit_path": null
    },
    {
      "id": "bkl-001-compile",
      "argv": [
        "python3",
        "-m",
        "compileall",
        "-q",
        "src/agent_workflow"
      ],
      "cwd": ".",
      "timeout_seconds": 120,
      "result_format": "exit-code",
      "junit_path": null
    }
  ],
  "scope": {
    "writable_paths": [],
    "writable_trees": [
      "src/",
      "tests/",
      "docs/",
      "schemas/"
    ],
    "disposable_trees": [
      ".agent-workflow-handoff/",
      ".delegations/"
    ]
  },
  "metrics": [
    {
      "id": "pass_rate",
      "kind": "binary",
      "direction": "higher_is_better",
      "missing_policy": "fail"
    },
    {
      "id": "elapsed_seconds",
      "kind": "duration",
      "direction": "lower_is_better",
      "missing_policy": "preserve-null"
    },
    {
      "id": "provider_billed_cost",
      "kind": "cost",
      "direction": "lower_is_better",
      "missing_policy": "preserve-null"
    }
  ],
  "stopping_rules": {
    "rule": "fixed_n",
    "minimum_cases": 1,
    "maximum_cases": 1,
    "confidence": 0.95,
    "effect_threshold": 0.0
  },
  "budgets": {
    "max_wall_seconds": 900,
    "max_input_tokens": 100000,
    "max_output_tokens": 20000,
    "max_cost": 0.0,
    "currency": "USD"
  },
  "privacy": {
    "data_class": "synthetic",
    "live_target_collection": false,
    "secret_policy": "prohibit"
  },
  "reproducibility": {
    "fixture_revision": "bkl-001-worktree-at-e1141f1",
    "prompt_sha256": "0000000000000000000000000000000000000000000000000000000000000000",
    "environment_sha256": "0000000000000000000000000000000000000000000000000000000000000000",
    "tool_policy_sha256": "0000000000000000000000000000000000000000000000000000000000000000",
    "pack_manifest_sha256": null
  },
  "sandbox": "docker",
  "oracle_refs": {},
  "statistics_policy": "agent-workflow/statistics/v1"
}
